group_id,title,published_at,url,keywords
1,Josh Hart’s iron-man feat earned him place in Knicks history,2024-03-20T03:57:20Z,https://nypost.com/2024/03/19/sports/josh-harts-iron-man-feat-earned-him-place-in-knicks-history/,"Iron, Earned, Place, Knicks"
2,"Florida city commissioner allegedly spent $100K of 96-year-old woman’s money on facelift, Miami hotel room",2024-03-20T05:36:06Z,https://nypost.com/2024/03/20/us-news/orlando-city-commissioner-regina-hill-allegedly-spent-100k-of-96-year-old-womans-money-on-facelift-miami-hotel-room/,"Florida, Commissioner, 100K, Woman’s"
3,[Removed],1970-01-01T00:00:00Z,https://removed.com,"Removed, Keywords, Title, Important"
4,[Removed],1970-01-01T00:00:00Z,https://removed.com,"Title: ""The Complete Guide to Online Marketing for Small Businesses""

Guide, Online, Marketing, Businesses"
